{
  "$schema": "https://quality.studio/schemas/change-review.v1.schema.json",
  "schemaVersion": 1,
  "changeSet": {
    "provider": "git-merge-range",
    "baseCommit": "5d60b3c7c6e8dde14c91ea96e7b2bec69b18c71b",
    "headCommit": "27875996b9aafcb2aa148e4afa4949ce4b62fc1f",
    "title": "chore: remove committed pipeline artifacts, ignore .orchestrator",
    "committedAt": "2026-07-23T00:06:22+02:00",
    "touchedFiles": [
      {
        "path": ".gitignore",
        "kind": "modified",
        "additions": 3,
        "deletions": 0,
        "contentChanged": true,
        "binary": false
      },
      {
        "path": ".orchestrator/jobs/tasks/000/QS-11/results/quality-home-dark--real.png",
        "kind": "deleted",
        "contentChanged": true,
        "binary": true
      },
      {
        "path": ".orchestrator/jobs/tasks/000/QS-11/results/quality-home-light--real.png",
        "kind": "deleted",
        "contentChanged": true,
        "binary": true
      }
    ]
  },
  "reviewedAt": "2026-07-25T11:13:39.1571114+00:00",
  "touchedUnits": [
    {
      "id": "path:project:.",
      "adapter": "path",
      "level": "project",
      "path": ".",
      "displayName": "Repository"
    },
    {
      "id": "path:module:.orchestrator",
      "adapter": "path",
      "level": "module",
      "path": ".orchestrator",
      "displayName": ".orchestrator"
    },
    {
      "id": "path:file:bc37d034bad564583790a46f19d807abfe519c5671395fd494d8cce506c42947",
      "adapter": "path",
      "level": "file",
      "path": ".gitignore",
      "displayName": ".gitignore"
    },
    {
      "id": "path:file:7c1869476f616e176d3835ca2078d6dd03be415028269d0d7641635420b6e41f",
      "adapter": "path",
      "level": "file",
      "path": ".orchestrator/jobs/tasks/000/QS-11/results/quality-home-dark--real.png",
      "displayName": "quality-home-dark--real.png"
    },
    {
      "id": "path:file:03e7b728e746ef5cb4cc554db3f556d9feb921b649655fe39f8122ac88a3a0ec",
      "adapter": "path",
      "level": "file",
      "path": ".orchestrator/jobs/tasks/000/QS-11/results/quality-home-light--real.png",
      "displayName": "quality-home-light--real.png"
    }
  ],
  "delta": {
    "grades": [],
    "findings": {
      "new": [],
      "resolved": [],
      "persisting": []
    },
    "newlyStale": [],
    "boundaries": {
      "new": [],
      "changed": [],
      "removed": []
    },
    "coverage": {
      "status": "unavailable",
      "reason": "Coverage ingestion is not available."
    },
    "churn": {
      "filesTouched": 3,
      "filesAdded": 0,
      "filesModified": 1,
      "filesDeleted": 2,
      "filesMoved": 0,
      "linesAdded": 3,
      "linesDeleted": 0,
      "repositoryFiles": 140,
      "blastRadiusPercent": 2.14
    },
    "onlyMoves": false,
    "hasQualityDelta": false
  },
  "judgement": {
    "status": "not-run",
    "reviewer": "none",
    "aspects": [
      {
        "id": "risk",
        "title": "Risk of the change",
        "verdict": "not-reviewed",
        "rationale": "Agent judgement was not requested."
      },
      {
        "id": "test-evidence",
        "title": "Test evidence",
        "verdict": "not-reviewed",
        "rationale": "Agent judgement was not requested."
      },
      {
        "id": "scope-discipline",
        "title": "Scope discipline",
        "verdict": "not-reviewed",
        "rationale": "Agent judgement was not requested."
      },
      {
        "id": "architecture-drift",
        "title": "Architecture drift",
        "verdict": "not-reviewed",
        "rationale": "Agent judgement was not requested."
      }
    ],
    "summary": "Deterministic evidence only."
  },
  "economy": {
    "diffFiles": 1,
    "fullSweepFiles": 1,
    "diffLines": 11,
    "diffCharacters": 230,
    "fullSweepCharacters": 328,
    "evidenceRatioPercent": 70.12,
    "savedPercent": 29.88
  },
  "verdict": "no-quality-delta",
  "summary": "No quality delta was observed in the standing review evidence for the touched units."
}
