{
  "$schema": "https://quality.studio/schemas/change-review.v1.schema.json",
  "schemaVersion": 1,
  "changeSet": {
    "provider": "git-merge-range",
    "baseCommit": "19ee7479edc4a08153cccdffb2073f94e46a9f3f",
    "headCommit": "fe07e6e2bafae3e5dd1c3ecd629432c3e9a064dc",
    "title": "QS folder view: clicking a folder always opens a list view with file infos and ratings",
    "committedAt": "2026-07-21T11:11:10+02:00",
    "touchedFiles": [
      {
        "path": "frontend/src/app/explorer/explorer.html",
        "kind": "modified",
        "additions": 3,
        "deletions": 1,
        "contentChanged": true,
        "binary": false
      },
      {
        "path": "frontend/src/app/explorer/explorer.spec.ts",
        "kind": "added",
        "additions": 48,
        "deletions": 0,
        "contentChanged": true,
        "binary": false
      },
      {
        "path": "frontend/src/app/explorer/explorer.ts",
        "kind": "modified",
        "additions": 7,
        "deletions": 0,
        "contentChanged": true,
        "binary": false
      }
    ]
  },
  "reviewedAt": "2026-07-25T11:13:36.4740172+00:00",
  "touchedUnits": [
    {
      "id": "path:project:.",
      "adapter": "path",
      "level": "project",
      "path": ".",
      "displayName": "Repository"
    },
    {
      "id": "path:module:frontend",
      "adapter": "path",
      "level": "module",
      "path": "frontend",
      "displayName": "frontend"
    },
    {
      "id": "path:file:0e684299f63cc75a0015d44ad6494567a336345fab0e06fd6fe0ec556db63150",
      "adapter": "path",
      "level": "file",
      "path": "frontend/src/app/explorer/explorer.html",
      "displayName": "explorer.html"
    },
    {
      "id": "path:file:b7bad1a5a6c3bbfbeff8c46d46ca6d5d8ebba4ba7d50a03c6e48bb959957a248",
      "adapter": "path",
      "level": "file",
      "path": "frontend/src/app/explorer/explorer.spec.ts",
      "displayName": "explorer.spec.ts"
    },
    {
      "id": "path:file:aa7d87b3c8f6dbeddb95d14d4bcf758484552d71df4971574c39a882c26353c1",
      "adapter": "path",
      "level": "file",
      "path": "frontend/src/app/explorer/explorer.ts",
      "displayName": "explorer.ts"
    }
  ],
  "delta": {
    "grades": [],
    "findings": {
      "new": [],
      "resolved": [],
      "persisting": []
    },
    "newlyStale": [],
    "boundaries": {
      "new": [],
      "changed": [],
      "removed": []
    },
    "coverage": {
      "status": "unavailable",
      "reason": "Coverage ingestion is not available."
    },
    "churn": {
      "filesTouched": 3,
      "filesAdded": 1,
      "filesModified": 2,
      "filesDeleted": 0,
      "filesMoved": 0,
      "linesAdded": 58,
      "linesDeleted": 1,
      "repositoryFiles": 126,
      "blastRadiusPercent": 2.38
    },
    "onlyMoves": false,
    "hasQualityDelta": false
  },
  "judgement": {
    "status": "not-run",
    "reviewer": "none",
    "aspects": [
      {
        "id": "risk",
        "title": "Risk of the change",
        "verdict": "not-reviewed",
        "rationale": "Agent judgement was not requested."
      },
      {
        "id": "test-evidence",
        "title": "Test evidence",
        "verdict": "not-reviewed",
        "rationale": "Agent judgement was not requested."
      },
      {
        "id": "scope-discipline",
        "title": "Scope discipline",
        "verdict": "not-reviewed",
        "rationale": "Agent judgement was not requested."
      },
      {
        "id": "architecture-drift",
        "title": "Architecture drift",
        "verdict": "not-reviewed",
        "rationale": "Agent judgement was not requested."
      }
    ],
    "summary": "Deterministic evidence only."
  },
  "economy": {
    "diffFiles": 3,
    "fullSweepFiles": 3,
    "diffLines": 87,
    "diffCharacters": 4128,
    "fullSweepCharacters": 14186,
    "evidenceRatioPercent": 29.1,
    "savedPercent": 70.9
  },
  "verdict": "no-quality-delta",
  "summary": "No quality delta was observed in the standing review evidence for the touched units."
}
